{"acquired_at":"2026-06-01T12:10:00Z","attempt_id":"fixture-release-attempt-001","attempt_terminal_slot":"release-attempt-terminals/fixture-release-attempt-001","binding_context_ref":{"artifact_id":"fixture-binding-context-m5","artifact_path":"contracts/fixtures/governance-models/valid/binding-context-m5.json","artifact_sha256":"d2518dd381d442c76be6af66291c310d7130ebe4e39b92584416e0a758d457aa","revision":1,"schema":"ylx.binding-context.v1"},"canonical_ga_target":"fixture-origin/refs/tags/v0.5.0","canonical_remote_id":"fixture-origin","contract_release_sha256":"ffeaf17fa88b81525de8bbffbfeaaff15900ea3661742d9b2eec086ef2f12300","domain_attestation_sha256_by_role_slot":{"build-platform-owner":"39052c58bbfecce6f48c9cf6f31316afff7096949227f2cf08f0e5569e166089","capture-owner":"7d53cc078f813b2666c7d551970147efe76484b1233c36b67b21b704300b1f5c","consumer-owner":"b715e0124265bf91fd1f8332d8439cd7b7aaadb36cdfac9a1e40d59e3f9c2b6f","contract-owner":"0df272cd01ec67d8b3f26e9876c60a1a12752cc9aec415c668bbe2e69bcc47fe","hardware-owner":"1c672ddea94565b151d4cddd79f8a7ba9d28fbf60f062a8c8a461296af39bdd5","network-owner":"ece9ec034608522d8d49698c3cdb17c944656b34765ca3394f6f06353ea82b57","pipeline-owner":"108d0e455069099c6575aae0076feccc99eaed0a5cbddba5b65f3f2ac4143160","qa-evidence-owner":"bc6b691f7c3f998447195738da44710e66017665b93a2a2bbc08a4abb64adb3a","release-owner":"696c4c68ce460d536b234325aae079c264ee64652cda73b582a351a58402f9f8","security-owner":"b021b80e9c1821816e216f9074e6ffb3503c518aac7b2a89e26432be192e322f","web-control-owner":"881687845dd6845ed2c731540f5e9ed06503d8e84b1c33c6bf1bc1d2b19155bf"},"fence_authority_id":"fixture-fence-authority","fence_semantics":{"aborted_state":"ABORTED_REFERENCE_DURABLE","acquisition":"CREATE_IF_ABSENT_SINGLE_ATTEMPT","active_derivation":"TERMINAL_SLOT_ABSENT","emergency_revocation":"TERMINATE_ATTEMPT_AND_KEEP_GA_QUARANTINED","finalized_state":"FINAL_REFERENCE_DURABLE","ga_visibility":"QUARANTINED_UNTIL_VALID_ACTIVE_DISTRIBUTION_HEAD","missing_manifest_state":"RELEASE_NOT_COMPLETE","ordinary_authority_successors":"BLOCKED_WHILE_ACTIVE","orphan_final_payload_state":"FINAL_PAYLOAD_DURABLE_NOT_ACTIVATED","parallel_attempts":"FORBIDDEN","post_finalized_cas_pre_readback_freshness_mismatch":"IMMUTABLE_INVALID_TERMINAL_NO_PASS_NO_RELEASE_COMPLETE_NO_OVERWRITE_OR_REUSE","pre_finalized_cas_freshness_mismatch":"ABORTED_AND_QUARANTINED","recovery":"SAME_IMMUTABLE_INPUTS_ONLY","release_condition":"FINAL_MANIFEST_PAYLOAD_AND_FINALIZED_SLOT_REFERENCE_DURABLE_EXACT_READBACK"},"fresh_issue_head":{"artifact_path":"valid/issue-register-head.json","head_artifact_sha256":"21cc6a6f329a16f6cb895725cc68392d9a8c9e0bd2aa7a146e8ea90b239a9805","overview_cardinality":1,"register_sha256":"7b441f0fb21a98dbf2f73363fd5e806011d5c872003b2167140a83c93100d5f3","revision":2,"selector_version":"issue-register-gate-selector.v1"},"ga_channel":"channels/ga/0.5","ga_promotion_plan_ref":{"artifact_id":"fixture-ga-promotion-plan-r1","artifact_path":"contracts/fixtures/governance-models/valid/ga-promotion-plan.json","artifact_sha256":"8383c218b05ceb324f2c4cc027268cf96c60e0147df35d7fc84026f9518a90c8","revision":1,"schema":"ylx.ga-promotion-plan.v1"},"ga_promotion_plan_sha256":"8383c218b05ceb324f2c4cc027268cf96c60e0147df35d7fc84026f9518a90c8","ga_ref":"refs/tags/v0.5.0","initial_customer_visibility":"QUARANTINED","key_validity_revocation_head_sha256":"6fa9102b8171a57d0ae8179ad039e5ceb1fa81187b0b4e196989916ff834758f","planned_promotion_operator":{"person_id":"fixture-ga-operator-person","role_assignment_artifact_sha256":"c7015c9dca3ba29455977712542c4cc555745b99a3ad6e6a8e125411b22efa32","role_assignment_revision":1},"pre_release_closure_ref":{"artifact_id":"fixture-release-closure-001","artifact_path":"contracts/fixtures/governance-models/valid/pre-release-closure.json","artifact_sha256":"2f236e9f48c898ca35f095583a68fdbe467bf5dd9d839dfb8b9571cba8ba238a","revision":1,"schema":"ylx.pre-release-closure.v1"},"pre_release_closure_sha256":"2f236e9f48c898ca35f095583a68fdbe467bf5dd9d839dfb8b9571cba8ba238a","product_contract_sha256":"fac531853410276fe9ebca29c631a9215222a84642df67e21ec70d2ca820ae11","qualification_governance_contract_sha256":"6c7c2518f163fa3883c22d2bb77fc57d4d10799b5cd1e50862eaf2e11da5a39e","quorum_policy_sha256":"4dc63d1a2729ac320941ae95f44bf456679b086a65eb1229397833e7e82216fe","quorum_signature_sha256_by_role_slot":{"contract-owner":"d6207b7ebd5af234261d6f5caa6f5da6f4b86b7fe4a29544c582cd4ef335e8f9","qa-evidence-owner":"e1cfe7ce50b7915cc9e54e9e6e1b0df915aac8afcea64be5734fb303d1595a4b","release-owner":"158d7cac0f6b04fce09d571edec13de3e11752f9c9c6981d397e8e1625bc9537","security-owner":"c682cebcd381398ebee72856d833d9ad7d9b43291935ff3a09af8f89951c06fd"},"rc_artifact_sha256":"1e66721c9fd40693ad584073c308978333c601b64ee4aeecf409e5f2f134ca49","rc_commit":"1111111111111111111111111111111111111111","rc_version":"0.5.0-rc.1","release_train":"fixture-release-train-0.5","required_key_validity_horizon_seconds":86400,"role_assignment_by_role_slot":{"contract-owner":{"assignment_artifact_sha256":"a1559d2d0421de9423a6e4505316e03bb6ca4bf1ca1713e47a2a42d0122ec47c","assignment_revision":1,"person_id":"fixture-contract-owner-person"},"qa-evidence-owner":{"assignment_artifact_sha256":"23b62eb7665df67342b38c829be47400e0501963502ef421995c8f2465e31db4","assignment_revision":1,"person_id":"fixture-qa-evidence-owner-person"},"release-owner":{"assignment_artifact_sha256":"586bc975bbffb25cffa58d192500cf19ff2829b8f614a7e5fcc75f8ade153400","assignment_revision":1,"person_id":"fixture-release-owner-person"},"security-owner":{"assignment_artifact_sha256":"5711be306926fb67c59368bbb47d608470e89688baf22db868b068bdfd21039b","assignment_revision":1,"person_id":"fixture-security-owner-person"}},"schema":"ylx.release-publication-fence.v1","signing_policy_sha256":"13c69df1431b8c499aac013b5f39ff673207a11eea267c920e81a976a03ab39c","system_milestone":"0.5"}